topic,site,url_root,headline,url,publish_date,publish_time
Southeast Asia,NST,https://www.nst.com.my/news,Man feared drowned after car found submerged in river,/nation/2025/07/1245314/man-feared-drowned-after-car-found-submerged-river,2025-07-15,22:08:58
Southeast Asia,NST,https://www.nst.com.my/news,PR bodies warn against unethical agencies promising instant media success,/nation/2025/07/1245312/pr-bodies-warn-against-unethical-agencies-promising-instant-media,2025-07-15,22:07:51
Southeast Asia,NST,https://www.nst.com.my/news,#NST180years: A legacy forged in time - NST's enduring journey,/nation/2025/07/1245310/nst180years-legacy-forged-time-nsts-enduring-journey,2025-07-15,21:58:24
Southeast Asia,NST,https://www.nst.com.my/news,14-year-old crushed to death by falling oil palm tree,/crime-courts/2025/07/1245306/14-year-old-crushed-death-falling-oil-palm-tree,2025-07-15,21:44:11
Southeast Asia,NST,https://www.nst.com.my/news,"#NST180years: Marking a milestone - A legacy of 180 years, built by many",/nation/2025/07/1245305/nst180years-marking-milestone-legacy-180-years-built-many,2025-07-15,21:44:04
Southeast Asia,NST,https://www.nst.com.my/news,Nine foreigners arrested for fighting with weapons at Bangsar construction site,/crime-courts/2025/07/1245302/nine-foreigners-arrested-fighting-weapons-bangsar-construction,2025-07-15,21:40:03
Southeast Asia,NST,https://www.nst.com.my/news,#NST180years: Mastering English key to global relevance,/nation/2025/07/1245300/nst180years-mastering-english-key-global-relevance,2025-07-15,21:35:49
Southeast Asia,NST,https://www.nst.com.my/news,#NST180years: NST at 180 - A story still unfolding,/nation/2025/07/1245298/nst180years-nst-180-story-still-unfolding,2025-07-15,21:29:01
Southeast Asia,NST,https://www.nst.com.my/news,Parang-wielding man detained after disrupting DBKL demolition,/crime-courts/2025/07/1245296/parang-wielding-man-detained-after-disrupting-dbkl-demolition,2025-07-15,21:27:59
Southeast Asia,NST,https://www.nst.com.my/news,#NST180years: A place to grow and become change-makers,/nation/2025/07/1245292/nst180years-place-grow-and-become-change-makers,2025-07-15,21:11:15
Southeast Asia,NST,https://www.nst.com.my/news,Shopee charts new growth strategies for local sellers,/nation/2025/07/1245287/shopee-charts-new-growth-strategies-local-sellers,2025-07-15,21:04:33
Southeast Asia,NST,https://www.nst.com.my/news,Two university students killed in crash with private ambulance at traffic light,/crime-courts/2025/07/1245285/two-university-students-killed-crash-private-ambulance-traffic,2025-07-15,21:03:51
Southeast Asia,NST,https://www.nst.com.my/news,"News@9: Today's top headlines - July 15, 2025 [WATCH]",/nation/2025/07/1245283/news9-todays-top-headlines-july-15-2025-watch,2025-07-15,21:01:50
Southeast Asia,NST,https://www.nst.com.my/news,#NST180years: The conscience of Malaysian sport,/nation/2025/07/1245275/nst180years-conscience-malaysian-sport,2025-07-15,20:54:15
Southeast Asia,NST,https://www.nst.com.my/news,#NST180years: Report nothing but the facts,/nation/2025/07/1245271/nst180years-report-nothing-facts,2025-07-15,20:49:43
Southeast Asia,NST,https://www.nst.com.my/news,"Traces of plastic pollution found as deep as 11,000m below sea level",/nation/2025/07/1245269/traces-plastic-pollution-found-deep-11000m-below-sea-level,2025-07-15,20:46:47
Southeast Asia,NST,https://www.nst.com.my/news,"With durian deluge, trader sells spiky gold for a steal",/nation/2025/07/1245266/durian-deluge-trader-sells-spiky-gold-steal,2025-07-15,20:44:45
Southeast Asia,NST,https://www.nst.com.my/news,"#NST180years: The stories we tell, the minds we shape",/nation/2025/07/1245264/nst180years-stories-we-tell-minds-we-shape,2025-07-15,20:44:14
Southeast Asia,NST,https://www.nst.com.my/news,"#NST180years: Like Thomas More, we are a newspaper for all seasons",/nation/2025/07/1245262/nst180years-thomas-more-we-are-newspaper-all-seasons,2025-07-15,20:36:42
Southeast Asia,NST,https://www.nst.com.my/news,#NST180years: Transformed by a powerful evolution,/nation/2025/07/1245258/nst180years-transformed-powerful-evolution,2025-07-15,20:28:20
Southeast Asia,NST,https://www.nst.com.my/news,"Umrah package firm, director charged for ignoring tribunal's RM232,000 award to consumers",/crime-courts/2025/07/1245253/umrah-package-firm-director-charged-ignoring-tribunals-rm232000,2025-07-15,20:27:29
Southeast Asia,NST,https://www.nst.com.my/news,Chery Tiggo Cross: A bold fusion,-cars-bikes-trucks/2025/07/1245249/chery-tiggo-cross-bold-fusion,2025-07-15,20:23:09
Southeast Asia,NST,https://www.nst.com.my/news,"Federal, Johor governments form task force to address critical healthcare staff shortage",/nation/2025/07/1245244/federal-johor-governments-form-task-force-address-critical-healthcare,2025-07-15,20:17:39
Southeast Asia,NST,https://www.nst.com.my/news,Modenas lineup takes centre stage at carnival day,-cars-bikes-trucks/2025/07/1245242/modenas-lineup-takes-centre-stage-carnival-day,2025-07-15,20:16:14
Science,Scientific American,https://www.scientificamerican.com/article,"AI Weather Forecasts Missed the Texas Floods, and Trump NOAA Cuts Will Stymie Research",/ai-weather-forecasts-missed-the-texas-floods-and-trump-noaa-cuts-will-stymie/,2025-07-15,18:15:00
Science,Scientific American,https://www.scientificamerican.com/article,Monster Black Hole Merger Is Most Massive Ever Seen,/monster-black-hole-merger-is-most-massive-ever-seen/,2025-07-15,17:00:00
Science,Scientific American,https://www.scientificamerican.com/article,Pneumonic Plague Infections in Modern Times Show the Black Death Isn't Dead,/pneumonic-plague-infections-in-modern-times-show-the-black-death-isnt-dead/,2025-07-15,16:45:00
Science,Scientific American,https://www.scientificamerican.com/article,"Bird Flu Is Killing Wildlife, and Experts Fear the Ecological Toll",/bird-flu-is-killing-wildlife-and-experts-fear-the-ecological-toll/,2025-07-15,13:00:00
Science,Scientific American,https://www.scientificamerican.com/article,Could Bird Flu Spread between Humans? Here's What It Would Take,/could-bird-flu-spread-between-humans-heres-what-it-would-take/,2025-07-15,13:00:00
Science,Scientific American,https://www.scientificamerican.com/article,Science Crossword: On the Fly,/science-crossword-on-the-fly/,2025-07-15,13:00:00
Science,Scientific American,https://www.scientificamerican.com/article,Bird Flu Is out of the News but Still Circulating,/bird-flu-is-out-of-the-news-but-still-circulating/,2025-07-15,13:00:00
Science,Scientific American,https://www.scientificamerican.com/article,How Influenza Reassortment May Make Bird Flu More Dangerous,/how-influenza-reassortment-may-make-bird-flu-more-dangerous/,2025-07-15,13:00:00
Science,Scientific American,https://www.scientificamerican.com/article,Doctors Discover New Blood Type-And Only One Person Has It,/doctors-discover-new-blood-type-and-only-one-person-has-it/,2025-07-15,11:00:00
Science,Scientific American,https://www.scientificamerican.com/article,Earth's Poles Have Shifted because of Water Dams,/earths-poles-have-shifted-because-of-water-dams/,2025-07-15,10:30:00
Science,Scientific American,https://www.scientificamerican.com/article,Texas Failed to Spend Federal Aid for Flood Disaster Protection,/texas-failed-to-spend-federal-aid-for-flood-disaster-protection/,2025-07-14,20:30:00
Science,Scientific American,https://www.scientificamerican.com/article,Science-Backed Ways to Deal with Stress,/science-backed-ways-to-deal-with-stress/,2025-07-14,14:00:00
Science,Scientific American,https://www.scientificamerican.com/article,Vibrio Bacteria in Beach Water Can Make You Seriously Ill,/vibrio-bacteria-in-beach-water-can-make-you-seriously-ill/,2025-07-14,13:00:00
Science,Scientific American,https://www.scientificamerican.com/article,"What New Biological Age 'Clocks' Say about Longevity, according to Eric Topol",/what-new-biological-age-clocks-say-about-longevity-according-to-eric-topol/,2025-07-14,11:00:00
Science,Scientific American,https://www.scientificamerican.com/article,"DeepMind's AlphaGenome Uses AI to Decipher Noncoding DNA for Research, Personalized Medicine",/deepminds-alphagenome-uses-ai-to-decipher-noncoding-dna-for-research/,2025-07-14,11:00:00
Science,Scientific American,https://www.scientificamerican.com/article,Elon Musk's New Grok 4 Takes on 'Humanity's Last Exam' as the AI Race Heats Up,/elon-musks-new-grok-4-takes-on-humanitys-last-exam-as-the-ai-race-heats-up/,2025-07-11,18:30:00
Science,Scientific American,https://www.scientificamerican.com/article,Marjorie Taylor Greene Plans Hearing on Geoengineering amid Cloud Seeding Conspiracy Theories,/marjorie-taylor-greene-plans-hearing-on-geoengineering-amid-cloud-seeding/,2025-07-11,15:30:00
Science,Scientific American,https://www.scientificamerican.com/article,Waste Wars Tracks the 'Wild Afterlife' of Garbage on an International Black Market,/waste-wars-tracks-the-wild-afterlife-of-garbage-on-an-international-black/,2025-07-11,12:00:00
Science,Scientific American,https://www.scientificamerican.com/article,"We're Light-Years Away from True Artificial Intelligence, Says Murderbot Author Martha Wells",/were-light-years-away-from-true-artificial-intelligence-says-murderbot/,2025-07-11,11:00:00
Science,Scientific American,https://www.scientificamerican.com/article,ChatGPT Is Changing the Words We Use in Conversation,/chatgpt-is-changing-the-words-we-use-in-conversation/,2025-07-11,11:00:00
Science,Scientific American,https://www.scientificamerican.com/article,Water on Mars Probably Doesn't Explain These Weird Streaks,/water-on-mars-probably-doesnt-explain-these-weird-streaks/,2025-07-11,10:45:00
Science,Scientific American,https://www.scientificamerican.com/article,Trump Names Transportation Secretary Sean Duffy as Interim NASA Chief,/trump-names-transportation-secretary-sean-duffy-as-interim-nasa-chief/,2025-07-10,16:45:00
Science,Scientific American,https://www.scientificamerican.com/article,Nanoplastics Make Up Most of the Ocean's Plastic Pollution,/nanoplastics-make-up-most-of-the-oceans-plastic-pollution/,2025-07-10,16:30:00
Science,Scientific American,https://www.scientificamerican.com/article,Extreme Heat Endangers AI Data Centers,/extreme-heat-endangers-ai-data-centers/,2025-07-10,16:00:00
Science,Scientific American,https://www.scientificamerican.com/article,Ancient Tooth Proteins Rewrite the Rhino Family Tree-Are Dinosaurs Next?,/ancient-tooth-proteins-rewrite-the-rhino-family-tree-are-dinosaurs-next/,2025-07-10,15:00:00
Science,Scientific American,https://www.scientificamerican.com/article,Can AI Replace Air Traffic Controllers to Reduce Airline Accidents?,/can-ai-replace-air-traffic-controllers-to-reduce-airline-accidents/,2025-07-10,14:00:00
Science,Scientific American,https://www.scientificamerican.com/article,Attacks on Higher Education Are Attacks on All Americans,/attacks-on-higher-education-are-attacks-on-all-americans/,2025-07-10,12:00:00
Science,Scientific American,https://www.scientificamerican.com/article,Four New Autism Subtypes Link Genes to Children's Traits,/four-new-autism-subtypes-link-genes-to-childrens-traits/,2025-07-10,11:00:00
Science,Scientific American,https://www.scientificamerican.com/article,'Science Fair' of Lost Research Protests Trump Cuts,/science-fair-of-lost-research-protests-trump-cuts/,2025-07-09,21:00:00
Science,Scientific American,https://www.scientificamerican.com/article,"Texas Floods Were a Known Risk, but Little Has Been Done for Protection",/texas-floods-were-a-known-risk-but-little-has-been-done-for-protection/,2025-07-09,16:00:00
Science,Scientific American,https://www.scientificamerican.com/article,Japan's New Undersea Earthquake Detection System Will Improve Tsunami Prediction,/japans-new-undersea-earthquake-detection-system-will-improve-tsunami/,2025-07-09,15:15:00
Science,Scientific American,https://www.scientificamerican.com/article,ChatGPT and Gemini AIs Have Uniquely Different Writing Styles,/chatgpt-and-gemini-ai-have-uniquely-different-writing-styles/,2025-07-09,12:00:00
Science,Scientific American,https://www.scientificamerican.com/article,"Gut Microbe Deficiency in U.S. Babies Tied to Asthma, Allergies, Autoimmune Disorders",/gut-microbe-deficiency-in-u-s-babies-tied-to-asthma-allergies-autoimmune/,2025-07-08,17:30:00
Science,Scientific American,https://www.scientificamerican.com/article,Flood Forecasts in Texas and Beyond Could Worsen with Trump NWS Cuts,/flood-forecasts-in-texas-and-beyond-could-worsen-with-trump-nws-cuts/,2025-07-08,16:30:00
Science,Scientific American,https://www.scientificamerican.com/article,Science Makes the U.S. a Great Nation,/science-makes-the-u-s-a-great-nation/,2025-07-08,14:00:00
Science,Scientific American,https://www.scientificamerican.com/article,Cutting-Edge Physics and Chemistry Now Unfold One Attosecond at a Time,/cutting-edge-physics-and-chemistry-now-unfold-one-attosecond-at-a-time/,2025-07-08,12:00:00
Science,Scientific American,https://www.scientificamerican.com/article,"Why Texas 'Flash Flood Alley' Is So Deadly, Explained by Geology",/why-texas-flash-flood-alley-is-so-deadly-explained-by-geology/,2025-07-07,20:40:00
Science,Scientific American,https://www.scientificamerican.com/article,The Benefits of Raising Conscientious Kids,/the-benefits-of-raising-conscientious-kids/,2025-07-07,20:00:00
Science,Scientific American,https://www.scientificamerican.com/article,Why Did Texas Flash Flood Waters Rise So Quickly?,/why-did-texas-flash-flood-waters-rise-so-quickly/,2025-07-07,16:00:00
Science,Scientific American,https://www.scientificamerican.com/article,Addiction Risk Shows up in Children's Brain Scans before Drug Use Starts,/addiction-risk-shows-up-in-childrens-brain-scans-before-drug-use-starts/,2025-07-07,15:15:00
Science,Scientific American,https://www.scientificamerican.com/article,Texas Flood Forecasts Were Accurate but Not Sufficient to Save Lives,/texas-flood-forecasts-were-accurate/,2025-07-07,15:00:00
Science,Scientific American,https://www.scientificamerican.com/article,Pulsing Magma in Earth's Mantle Drives Tectonic Plates Tearing Africa Apart,/pulsing-magma-in-earths-mantle-drives-tectonic-plates-tearing-africa-apart/,2025-07-07,10:30:00
Science,Scientific American,https://www.scientificamerican.com/article,Math's Block-Stacking Problem Has a Preposterous Solution,/maths-block-stacking-problem-has-a-preposterous-solution/,2025-07-06,11:00:00
Science,Scientific American,https://www.scientificamerican.com/article,"Climate Change's Fingerprints Came Early, a Thought Experiment Reveals",/climate-changes-fingerprints-came-early-a-thought-experiment-reveals/,2025-07-04,14:00:00
Science,Scientific American,https://www.scientificamerican.com/article,Workers Have Died in Extreme Heat as OSHA Has Debated Protections,/workers-have-died-in-extreme-heat-as-osha-has-debated-protections/,2025-07-04,12:00:00
Science,Scientific American,https://www.scientificamerican.com/article,Human Gut Bacteria Can Gather Up PFAS 'Forever Chemicals',/human-gut-bacteria-can-gather-up-pfas-forever-chemicals/,2025-07-04,11:30:00
