topic,site,url_root,headline,url,publish_date,publish_time
Southeast Asia,NST,https://www.nst.com.my/news,Proposed Finas Act amendment aligns with technological advancements - Teo,/nation/2025/07/1246926/proposed-finas-act-amendment-aligns-technological-advancements-teo,2025-07-18,23:50:45
Southeast Asia,NST,https://www.nst.com.my/news,Every fatwa in Selangor goes through rigorous process - Sultan Sharafuddin,/nation/2025/07/1246924/every-fatwa-selangor-goes-through-rigorous-process-sultan-sharafuddin,2025-07-18,23:45:34
Southeast Asia,NST,https://www.nst.com.my/news,"Over 20,000 companies use Sirim's testing, expertise every year",/nation/2025/07/1246920/over-20000-companies-use-sirims-testing-expertise-every-year,2025-07-18,23:33:29
Southeast Asia,NST,https://www.nst.com.my/news,Imam dies while leading Friday prayers in Raub,/nation/2025/07/1246918/imam-dies-while-leading-friday-prayers-raub,2025-07-18,23:08:16
Southeast Asia,NST,https://www.nst.com.my/news,"[UPDATED] Paris court concludes hearing on Sulu award dispute, decision expected Dec 9",/crime-courts/2025/07/1246914/updated-paris-court-concludes-hearing-sulu-award-dispute-decision,2025-07-18,22:55:36
Southeast Asia,NST,https://www.nst.com.my/news,Noor Afifah becomes first woman appointed as SKM CEO,/nation/2025/07/1246912/noor-afifah-becomes-first-woman-appointed-skm-ceo,2025-07-18,22:53:38
Southeast Asia,NST,https://www.nst.com.my/news,"Today's news in pictures - Friday, July 18, 2025",/nation/2025/07/1246910/todays-news-pictures-friday-july-18-2025,2025-07-18,22:47:55
Southeast Asia,NST,https://www.nst.com.my/news,Two boys found dead after falling into drain in Shah Alam,/nation/2025/07/1246900/two-boys-found-dead-after-falling-drain-shah-alam,2025-07-18,22:28:05
Southeast Asia,NST,https://www.nst.com.my/news,Elderly woman found dead in locked Penang apartment,/nation/2025/07/1246898/elderly-woman-found-dead-locked-penang-apartment,2025-07-18,22:21:49
Southeast Asia,NST,https://www.nst.com.my/news,Slanderous politics reaches alarming level - Ramanan,/politics/2025/07/1246896/slanderous-politics-reaches-alarming-level-ramanan,2025-07-18,22:13:01
Southeast Asia,NST,https://www.nst.com.my/news,Jo Ghani: Govt exploring ways to expand biodiesel use,/nation/2025/07/1246894/jo-ghani-govt-exploring-ways-expand-biodiesel-use,2025-07-18,22:03:05
Southeast Asia,NST,https://www.nst.com.my/news,Supplementary electoral roll for June open for review - EC,/nation/2025/07/1246892/supplementary-electoral-roll-june-open-review-ec,2025-07-18,21:47:35
Southeast Asia,NST,https://www.nst.com.my/news,DBKL reinstates partial Sunday road closure for Jalan TAR,/nation/2025/07/1246882/dbkl-reinstates-partial-sunday-road-closure-jalan-tar,2025-07-18,21:17:17
Southeast Asia,NST,https://www.nst.com.my/news,"News@9: Today's top headlines - July 18, 2025 [WATCH]",/nation/2025/07/1246877/news9-todays-top-headlines-july-18-2025-watch,2025-07-18,21:01:18
Southeast Asia,NST,https://www.nst.com.my/news,Jo Ghani: National Climate Change Bill to include incentives for carbon reduction,/nation/2025/07/1246875/jo-ghani-national-climate-change-bill-include-incentives-carbon,2025-07-18,20:56:00
Southeast Asia,NST,https://www.nst.com.my/news,Egyptian man held over suspicion of using fake passport,/crime-courts/2025/07/1246873/egyptian-man-held-over-suspicion-using-fake-passport,2025-07-18,20:44:46
Southeast Asia,NST,https://www.nst.com.my/news,MCMC probes fake Instagram post on CJ's appointment,/nation/2025/07/1246867/mcmc-probes-fake-instagram-post-cjs-appointment,2025-07-18,20:25:20
Southeast Asia,NST,https://www.nst.com.my/news,"13MP to dominate next Dewan Rakyat sitting, debate may run into the night - Speaker",/nation/2025/07/1246857/13mp-dominate-next-dewan-rakyat-sitting-debate-may-run-night-speaker,2025-07-18,20:01:23
Southeast Asia,NST,https://www.nst.com.my/news,Bersih welcomes appointment of Malaysia's 3 top judges,/nation/2025/07/1246851/bersih-welcomes-appointment-malaysias-3-top-judges,2025-07-18,19:51:23
Science,Scientific American,https://www.scientificamerican.com/article,Tests that AIs Often Fail and Humans Ace Could Pave the Way for Artificial General Intelligence,/tests-that-ais-often-fail-and-humans-ace-could-pave-the-way-for-artificial/,2025-07-18,17:00:00
Science,Scientific American,https://www.scientificamerican.com/article,Can U.S. Math Research Survive NSF Funding Cuts?,/can-u-s-math-research-survive-nsf-funding-cuts/,2025-07-18,14:30:00
Science,Scientific American,https://www.scientificamerican.com/article,"This Number System Beats Binary, But Most Computers Can't Use It",/this-number-system-beats-binary-but-most-computers-cant-use-it/,2025-07-18,12:00:00
Science,Scientific American,https://www.scientificamerican.com/article,Can You Drink Saturn's Rings?,/can-you-drink-saturns-rings/,2025-07-18,10:45:00
Science,Scientific American,https://www.scientificamerican.com/article,"What Is Chronic Venous Insufficiency, Trump's Blood Vessel Condition?",/what-is-chronic-venous-insufficiency-trumps-blood-vessel-condition/,2025-07-17,21:18:00
Science,Scientific American,https://www.scientificamerican.com/article,New Thermal Hole Opens at Yellowstone National Park,/new-thermal-hole-opens-at-yellowstone-national-park/,2025-07-17,20:40:00
Science,Scientific American,https://www.scientificamerican.com/article,Three-Person Mitochondrial IVF Leads to Eight Healthy Births,/three-person-mitochondrial-ivf-leads-to-eight-healthy-births/,2025-07-17,19:00:00
Science,Scientific American,https://www.scientificamerican.com/article,Brain Activity Patterns Reveal Why Waking Up from Sleep Can Be So Difficult,/brain-activity-patterns-reveal-why-waking-up-from-sleep-can-be-so-difficult/,2025-07-17,17:50:00
Science,Scientific American,https://www.scientificamerican.com/article,New Interstellar Object 3I/ATLAS's Biggest Mysteries Explained,/new-interstellar-object-3i-atlass-biggest-mysteries-explained/,2025-07-17,13:30:00
Science,Scientific American,https://www.scientificamerican.com/article,"How Trump's One Big Beautiful Bill Act Will Raise Energy Costs, Carbon Emissions",/how-trumps-one-big-beautiful-bill-act-will-raise-energy-costs-carbon/,2025-07-16,18:15:00
Science,Scientific American,https://www.scientificamerican.com/article,New Parkinson's Implant Listens to Brain Waves to Treat Symptoms,/new-parkinsons-implant-listens-to-brain-waves-to-treat-symptoms/,2025-07-16,16:00:00
Science,Scientific American,https://www.scientificamerican.com/article,Astronomers See Planet Formation 'Time Zero' in an Alien Solar System,/astronomers-see-planet-formation-time-zero-in-an-alien-solar-system/,2025-07-16,15:45:00
Science,Scientific American,https://www.scientificamerican.com/article,The Large Hadron Collider Discovers Antimatter Behaving Oddly in New Class of Particles,/the-large-hadron-collider-discovers-antimatter-behaving-oddly-in-new-class/,2025-07-16,15:00:00
Science,Scientific American,https://www.scientificamerican.com/article,The Link between Weather and Migraines Explained by a Neurologist,/the-link-between-weather-and-migraines-explained-by-a-neurologist/,2025-07-16,12:00:00
Science,Scientific American,https://www.scientificamerican.com/article,China Powers AI Boom with Undersea Data Centers,/china-powers-ai-boom-with-undersea-data-centers/,2025-07-16,10:30:00
Science,Scientific American,https://www.scientificamerican.com/article,Aging Rates Vary by Country. Politics Might Be Why,/aging-rates-vary-by-country-politics-might-be-why/,2025-07-15,20:30:00
Science,Scientific American,https://www.scientificamerican.com/article,"AI Weather Forecasts Missed the Texas Floods, and Trump NOAA Cuts Will Stymie Research",/ai-weather-forecasts-missed-the-texas-floods-and-trump-noaa-cuts-will-stymie/,2025-07-15,18:15:00
Science,Scientific American,https://www.scientificamerican.com/article,Monster Black Hole Merger Is Most Massive Ever Seen,/monster-black-hole-merger-is-most-massive-ever-seen/,2025-07-15,17:00:00
Science,Scientific American,https://www.scientificamerican.com/article,Pneumonic Plague Infections in Modern Times Show the Black Death Isn't Dead,/pneumonic-plague-infections-in-modern-times-show-the-black-death-isnt-dead/,2025-07-15,16:45:00
Science,Scientific American,https://www.scientificamerican.com/article,Science Crossword: On the Fly,/science-crossword-on-the-fly/,2025-07-15,13:00:00
Science,Scientific American,https://www.scientificamerican.com/article,"Bird Flu Is Killing Wildlife, and Experts Fear the Ecological Toll",/bird-flu-is-killing-wildlife-and-experts-fear-the-ecological-toll/,2025-07-15,13:00:00
Science,Scientific American,https://www.scientificamerican.com/article,Could Bird Flu Spread between Humans? Here's What It Would Take,/could-bird-flu-spread-between-humans-heres-what-it-would-take/,2025-07-15,13:00:00
Science,Scientific American,https://www.scientificamerican.com/article,Bird Flu Is out of the News but Still Circulating,/bird-flu-is-out-of-the-news-but-still-circulating/,2025-07-15,13:00:00
Science,Scientific American,https://www.scientificamerican.com/article,How Influenza Reassortment May Make Bird Flu More Dangerous,/how-influenza-reassortment-may-make-bird-flu-more-dangerous/,2025-07-15,13:00:00
Science,Scientific American,https://www.scientificamerican.com/article,Doctors Discover New Blood Type-And Only One Person Has It,/doctors-discover-new-blood-type-and-only-one-person-has-it/,2025-07-15,11:00:00
Science,Scientific American,https://www.scientificamerican.com/article,Earth's Poles Have Shifted because of Water Dams,/earths-poles-have-shifted-because-of-water-dams/,2025-07-15,10:30:00
Science,Scientific American,https://www.scientificamerican.com/article,Texas Failed to Spend Federal Aid for Flood Disaster Protection,/texas-failed-to-spend-federal-aid-for-flood-disaster-protection/,2025-07-14,20:30:00
Science,Scientific American,https://www.scientificamerican.com/article,Science-Backed Ways to Deal with Stress,/science-backed-ways-to-deal-with-stress/,2025-07-14,14:00:00
Science,Scientific American,https://www.scientificamerican.com/article,Vibrio Bacteria in Beach Water Can Make You Seriously Ill,/vibrio-bacteria-in-beach-water-can-make-you-seriously-ill/,2025-07-14,13:00:00
Science,Scientific American,https://www.scientificamerican.com/article,"What New Biological Age 'Clocks' Say about Longevity, according to Eric Topol",/what-new-biological-age-clocks-say-about-longevity-according-to-eric-topol/,2025-07-14,11:00:00
Science,Scientific American,https://www.scientificamerican.com/article,"DeepMind's AlphaGenome Uses AI to Decipher Noncoding DNA for Research, Personalized Medicine",/deepminds-alphagenome-uses-ai-to-decipher-noncoding-dna-for-research/,2025-07-14,11:00:00
Science,Scientific American,https://www.scientificamerican.com/article,Elon Musk's New Grok 4 Takes on 'Humanity's Last Exam' as the AI Race Heats Up,/elon-musks-new-grok-4-takes-on-humanitys-last-exam-as-the-ai-race-heats-up/,2025-07-11,18:30:00
Science,Scientific American,https://www.scientificamerican.com/article,Marjorie Taylor Greene Plans Hearing on Geoengineering amid Cloud Seeding Conspiracy Theories,/marjorie-taylor-greene-plans-hearing-on-geoengineering-amid-cloud-seeding/,2025-07-11,15:30:00
Science,Scientific American,https://www.scientificamerican.com/article,Waste Wars Tracks the 'Wild Afterlife' of Garbage on an International Black Market,/waste-wars-tracks-the-wild-afterlife-of-garbage-on-an-international-black/,2025-07-11,12:00:00
Science,Scientific American,https://www.scientificamerican.com/article,"We're Light-Years Away from True Artificial Intelligence, Says Murderbot Author Martha Wells",/were-light-years-away-from-true-artificial-intelligence-says-murderbot/,2025-07-11,11:00:00
Science,Scientific American,https://www.scientificamerican.com/article,ChatGPT Is Changing the Words We Use in Conversation,/chatgpt-is-changing-the-words-we-use-in-conversation/,2025-07-11,11:00:00
Science,Scientific American,https://www.scientificamerican.com/article,Water on Mars Probably Doesn't Explain These Weird Streaks,/water-on-mars-probably-doesnt-explain-these-weird-streaks/,2025-07-11,10:45:00
Science,Scientific American,https://www.scientificamerican.com/article,Trump Names Transportation Secretary Sean Duffy as Interim NASA Chief,/trump-names-transportation-secretary-sean-duffy-as-interim-nasa-chief/,2025-07-10,16:45:00
Science,Scientific American,https://www.scientificamerican.com/article,Nanoplastics Make Up Most of the Ocean's Plastic Pollution,/nanoplastics-make-up-most-of-the-oceans-plastic-pollution/,2025-07-10,16:30:00
Science,Scientific American,https://www.scientificamerican.com/article,Extreme Heat Endangers AI Data Centers,/extreme-heat-endangers-ai-data-centers/,2025-07-10,16:00:00
Science,Scientific American,https://www.scientificamerican.com/article,Ancient Tooth Proteins Rewrite the Rhino Family Tree-Are Dinosaurs Next?,/ancient-tooth-proteins-rewrite-the-rhino-family-tree-are-dinosaurs-next/,2025-07-10,15:00:00
Science,Scientific American,https://www.scientificamerican.com/article,Can AI Replace Air Traffic Controllers to Reduce Airline Accidents?,/can-ai-replace-air-traffic-controllers-to-reduce-airline-accidents/,2025-07-10,14:00:00
Science,Scientific American,https://www.scientificamerican.com/article,Attacks on Higher Education Are Attacks on All Americans,/attacks-on-higher-education-are-attacks-on-all-americans/,2025-07-10,12:00:00
Science,Scientific American,https://www.scientificamerican.com/article,Four New Autism Subtypes Link Genes to Children's Traits,/four-new-autism-subtypes-link-genes-to-childrens-traits/,2025-07-10,11:00:00
Science,Scientific American,https://www.scientificamerican.com/article,'Science Fair' of Lost Research Protests Trump Cuts,/science-fair-of-lost-research-protests-trump-cuts/,2025-07-09,21:00:00
Science,Scientific American,https://www.scientificamerican.com/article,"Texas Floods Were a Known Risk, but Little Has Been Done for Protection",/texas-floods-were-a-known-risk-but-little-has-been-done-for-protection/,2025-07-09,16:00:00
